{"contract_version":"1.0.0","run_id":"11111111-1111-4111-8111-111111111111","briefing_hash":"sha256:aaaaaaaaaaaaaaaaaaaaaaaaaaaaaaaaaaaaaaaaaaaaaaaaaaaaaaaaaaaaaaaa","product_goal":"Permitir reservas de salas.","stories":[{"story_id":"STORY-001","title":"Criar reserva","narrative":"Como colaborador, quero reservar uma sala para organizar uma reunião.","priority":"MUST","depends_on":[],"acceptance_criteria":[{"criterion_id":"AC-001","order":1,"description":"A reserva válida é persistida.","verification":"Consultar a reserva pela API retorna os mesmos dados."}],"ready":true}],"constraints":["Aplicação web responsiva."],"assumptions":["Usuários já estão autenticados."],"out_of_scope":["Pagamento."],"coverage":[{"briefing_item":"Reserva de sala","story_ids":["STORY-001"]}],"decisions":["Priorizar o fluxo principal."],"needs_human":[]}
